Sheet: 1-Proje Tanımları
A1: PROJE BİLGİLERİ | B1: DEĞER | C1: BİRİM
A2: Tünel Uzunluğu | B2: 250 | C2: m
A3: Tünel Sayısı | B3: 50 | C3: adet
A4: Tünel Genişlik | B4: 9.6 | C4: m
A5: Duvar Kolon Arası | B5: 2.5 | C5: m
A6: Orta Kolon Aralığı | B6: 5 | C6: m
A7: Oluk Boyu | B7: 5 | C7: m
A8: Tek Akıntı | B8: 1 | C8: adet
A9: Çift Akıntılı | B9: 2 | C9: adet
A10: Duvar Üstü | B10: 2 | C10: adet
A11: Baştaki Kolonlar (80x80x5000) | B11: 102 | C11: adet
A12: HESAPLANAN DEĞERLER | B12: SONUÇ | C12: BİRİM
A13: Toplam Alan | B13: =B2*B3*B4 -> 120000 | C13: m²
A14: Toplam Montaj Noktası | B14: =(B2/B5+1)*(B3+1) -> 2601 | C14: adet
A15: Toplam Direk Uzunluğu | B15: =B2*B3 -> 12500 | C15: m

Sheet: 2-Montaj Noktası
A1: NO | B1: İMAL KODU | C1: MALZEME TANIMI | D1: MİKTAR | E1: BİRİM FİYAT | F1: BİRİM AĞIRLIK | G1: TOPLAM MALİYET
A2: 1 | B2: BP-01 | C2: 70*70*1200*2,00 mm Ankaraj | D2: 1 | E2: 125.50 | F2: 5.1 | G2: =D2*E2 -> 125.50
A3: 2 | B3: BP-02 | C3: 80*80*3000*3,00 mm Direk | D3: 1 | E3: 285.75 | F3: 12.8 | G3: =D3*E3 -> 285.75
A4: 3 | B4: BP-03 | C4: Montaj Plakası 200*200*8mm | D4: 2 | E4: 45.25 | F4: 2.5 | G4: =D4*E4 -> 90.50
A5: 4 | B5: BP-04 | C5: Bağlantı Elemanı M12*80 | D5: 4 | E5: 8.75 | F5: 0.2 | G5: =D5*E5 -> 35.00
A6: 5 | B6: BP-05 | C6: Kaynak İşçiliği | D6: 1 | E6: 65.00 | F6: - | G6: =D6*E6 -> 65.00
A7: 1 MONTAJ NOKTASI TOPLAM MALİYET | G7: =SUM(G2:G6) -> 601.75

Sheet: 3-Metre Direk
A1: NO | B1: İMAL KODU | C1: MALZEME TANIMI | D1: MİKTAR | E1: BİRİM FİYAT | F1: BİRİM AĞIRLIK | G1: TOPLAM MALİYET
A2: 1 | B2: MD-01 | C2: 80*80*1000*2,5mm Ara Direk | D2: 1 | E2: 95.25 | F2: 7.8 | G2: =D2*E2 -> 95.25
A3: 2 | B3: MD-02 | C3: Bağlantı Flanşı | D3: 2 | E3: 25.50 | F3: 1.2 | G3: =D3*E3 -> 51.00
A4: 3 | B4: MD-03 | C4: Galvaniz Boyama | D4: 1 | E4: 15.75 | F4: - | G4: =D4*E4 -> 15.75
A5: 1 METRE DİREK TOPLAM MALİYET | G5: =SUM(G2:G4) -> 162.00

Sheet: 4-Müştemilat Direk
A1: NO | B1: İMAL KODU | C1: MALZEME TANIMI | D1: MİKTAR | E1: BİRİM FİYAT | F1: BİRİM AĞIRLIK | G1: TOPLAM MALİYET
A2: 1 | B2: MS-01 | C2: 80*80*2500*3,0mm Müştemilat Dirrek | D2: 1 | E2: 238.50 | F2: 18.5 | G2: =D2*E2 -> 238.50
A3: 2 | B3: MS-02 | C3: Temel Ankrajı 70*70*800mm | D3: 1 | E3: 85.25 | F3: 3.8 | G3: =D3*E3 -> 85.25
A4: 3 | B4: MS-03 | C4: Üst Bağlantı Aparatı | D4: 1 | E4: 45.75 | F4: 2.2 | G4: =D4*E4 -> 45.75
A5: 4 | B5: MS-04 | C5: Montaj İşçiliği | D5: 1 | E5: 75.00 | F5: - | G5: =D5*E5 -> 75.00
A6: 1 MÜŞTEMİLAT DİREK TOPLAM MALİYET | G6: =SUM(G2:G5) -> 444.50

Sheet: 5-Toplam Maliyet
A1: SERA PROJESİ TOPLAM MALİYET HESAPLAMA
A2: MALİYET KALEMİ | B2: MİKTAR | C2: BİRİM MALİYET | D2: TOPLAM MALİYET
A3: Montaj Noktası Sayısı | B3: ='1-Proje Tanımları'.B14 -> 2601 | C3: ='2-Montaj Noktası'.G7 -> 601.75 | D3: =B3*C3 -> 1565215.75
A4: Ara Direk Uzunluğu (metre) | B4: ='1-Proje Tanımları'.B15 -> 12500 | C4: ='3-Metre Direk'.G5 -> 162.00 | D4: =B4*C4 -> 2025000.00
A5: Müştemilat Direk Sayısı | B5: 25 | C5: ='4-Müştemilat Direk'.G6 -> 444.50 | D5: =B5*C5 -> 11112.50
A6: TOPLAM MALZEMe MALİYETİ | D6: =SUM(D3:D5) -> 3601328.25
A7: İşçilik %15 | B7: - | C7: - | D7: =D6*0.15 -> 540199.24
A8: Nakliye %5 | B8: - | C8: - | D8: =D6*0.05 -> 180066.41
A9: Kar %10 | B9: - | C9: - | D9: =D6*0.10 -> 360132.83
A10: TOPLAM PROJE MALİYETİ (KDV HARİÇ) | D10: =SUM(D6:D9) -> 4681726.73
A11: KDV %20 | B11: - | C11: - | D11: =D10*0.20 -> 936345.35
A12: TOPLAM PROJE MALİYETİ (KDV DAHİL)
A13: M² BAŞINA MALİYET HESAPLAMA
A14: Toplam Alan (m²) | B14: ='1-Proje Tanımları'.B13 -> 120000 | C14: - | D14: -
A15: M² Başına Maliyet (KDV Hariç) | B15: - | C15: - | D15: =D10/B14 -> 39.01
A16: M² Başına Maliyet (KDV Dahil) | B16: - | C16: - | D16: =D12/B14 -> 46.82